{
  "contract_version": "DIARY_ONE_PRODUCTION_PIPELINE_V1_0",
  "run": {
    "run_id": "run_20260829_reference_01",
    "user_local_day": "2026-08-29",
    "revision_id": "revision_final_01",
    "revision_kind": "FINAL",
    "snapshot_id": "snapshot_01",
    "pipeline_version": "PRODUCTION_SHAPED_V1_0",
    "expected_published_head": null
  },
  "writer_provenance": {
    "execution_mode": "REFERENCE_PRECOMPUTED",
    "source_artifact_ref": "fixture://production_v1/ancient_town_reference_day",
    "provider": "NONE",
    "model": "NONE",
    "prompt_version": "S11_REFERENCE_FIXTURE_V1",
    "parameter_version": "S11_REFERENCE_V1",
    "logical_calls": 0,
    "input_tokens": 0,
    "output_tokens": 0,
    "estimated_cost_usd": 0,
    "cache_status": "NOT_APPLICABLE_REFERENCE"
  },
  "upstream_stages": [
    {"stage_id": "S00", "artifact_ref": "artifact://s00/run", "revision_id": "revision_final_01", "snapshot_id": "snapshot_01", "status": "READY", "fingerprint": "fp_s00"},
    {"stage_id": "S01", "artifact_ref": "artifact://s01/raw-ledger", "revision_id": "revision_final_01", "snapshot_id": "snapshot_01", "status": "READY", "fingerprint": "fp_s01"},
    {"stage_id": "S02", "artifact_ref": "artifact://s02/evidence", "revision_id": "revision_final_01", "snapshot_id": "snapshot_01", "status": "READY", "fingerprint": "fp_s02"},
    {"stage_id": "S03", "artifact_ref": "artifact://s03/signals", "revision_id": "revision_final_01", "snapshot_id": "snapshot_01", "status": "READY", "fingerprint": "fp_s03"},
    {"stage_id": "S04", "artifact_ref": "artifact://s04/observations", "revision_id": "revision_final_01", "snapshot_id": "snapshot_01", "status": "READY", "fingerprint": "fp_s04"},
    {"stage_id": "S05", "artifact_ref": "artifact://s05/moments", "revision_id": "revision_final_01", "snapshot_id": "snapshot_01", "status": "READY", "fingerprint": "fp_s05"},
    {"stage_id": "S06", "artifact_ref": "artifact://s06/roles", "revision_id": "revision_final_01", "snapshot_id": "snapshot_01", "status": "READY", "fingerprint": "fp_s06"},
    {"stage_id": "S07", "artifact_ref": "artifact://s07/candidates", "revision_id": "revision_final_01", "snapshot_id": "snapshot_01", "status": "READY", "fingerprint": "fp_s07"},
    {"stage_id": "S08", "artifact_ref": "artifact://s08/validation", "revision_id": "revision_final_01", "snapshot_id": "snapshot_01", "status": "READY", "fingerprint": "fp_s08"},
    {"stage_id": "S09", "artifact_ref": "artifact://s09/selection", "revision_id": "revision_final_01", "snapshot_id": "snapshot_01", "status": "READY", "fingerprint": "fp_s09"},
    {"stage_id": "S10", "artifact_ref": "artifact://s10/media-plan", "revision_id": "revision_final_01", "snapshot_id": "snapshot_01", "status": "READY", "fingerprint": "fp_s10"}
  ],
  "s09": {
    "day_state": "CHAPTER_DAY",
    "selected_chapter_ids": ["chapter_ancient_town"],
    "selected_aha_ids": ["aha_playful_cat"],
    "chapter_aha_pair_decisions": [
      {
        "chapter_id": "chapter_ancient_town",
        "aha_id": "aha_playful_cat",
        "decision": "NARRATIVELY_DISTINCT_PASS"
      }
    ]
  },
  "memories": [
    {
      "memory_id": "chapter_ancient_town",
      "memory_type": "CHAPTER",
      "candidate_id": "candidate_chapter_01",
      "revision_id": "revision_final_01",
      "capture_start_ms": 32400000,
      "selected_content_unit_ids": ["unit_gate", "unit_hall", "unit_river"],
      "compact_pair_gate": "NOT_APPLICABLE",
      "active_media": [
        {
          "media_id": "media_gate",
          "media_plan_ref": "media_plan_gate",
          "evidence_anchor_ref": "anchor_gate",
          "raw_asset_id": "auto_001",
          "format": "PHOTO",
          "hq_request_id": "hq_gate",
          "semantic_scope_id": "scope_gate",
          "source_family_id": "source_family_gate",
          "is_hero": true
        },
        {
          "media_id": "media_hall",
          "media_plan_ref": "media_plan_hall",
          "evidence_anchor_ref": "anchor_hall",
          "raw_asset_id": "manual_photo_01",
          "format": "LIVE_2S",
          "hq_request_id": "hq_hall",
          "semantic_scope_id": "scope_hall",
          "source_family_id": "source_family_hall",
          "is_hero": false
        },
        {
          "media_id": "media_river",
          "media_plan_ref": "media_plan_river",
          "evidence_anchor_ref": "anchor_river",
          "raw_asset_id": "auto_046",
          "format": "PHOTO",
          "hq_request_id": "hq_river",
          "semantic_scope_id": "scope_river",
          "source_family_id": "source_family_river",
          "is_hero": false
        }
      ],
      "claims": [
        {
          "claim_id": "claim_city_walk",
          "normalized_assertion": "用户在古镇街区步行",
          "semantic_status": "CLAIM_SEMANTIC_SUPPORTED",
          "support_grade": "STRONG",
          "evidence_refs": ["observation_gate", "observation_river", "continuity_ledger_01"],
          "allowed_surfaces": ["TITLE", "STORY", "CANONICAL_TAG"]
        },
        {
          "claim_id": "claim_architecture",
          "normalized_assertion": "石板路和传统建筑出现在这段经历中",
          "semantic_status": "CLAIM_SEMANTIC_SUPPORTED",
          "support_grade": "STRONG",
          "evidence_refs": ["observation_gate", "observation_hall"],
          "allowed_surfaces": ["STORY", "CANONICAL_TAG"]
        },
        {
          "claim_id": "claim_river_light",
          "normalized_assertion": "抵达河边时，晚光落在水面",
          "semantic_status": "CLAIM_SEMANTIC_SUPPORTED",
          "support_grade": "MODERATE",
          "evidence_refs": ["observation_river", "frame_river_02"],
          "allowed_surfaces": ["STORY"]
        },
        {
          "claim_id": "claim_exact_place",
          "normalized_assertion": "可信地点实体为周庄古镇",
          "semantic_status": "CLAIM_SEMANTIC_SUPPORTED",
          "support_grade": "STRONG",
          "evidence_refs": ["user_confirmed_place_01"],
          "allowed_surfaces": ["TITLE", "STORY", "CANONICAL_TAG"]
        },
        {
          "claim_id": "claim_travel_outing",
          "normalized_assertion": "该记忆属于一次旅行出游",
          "semantic_status": "CLAIM_SEMANTIC_SUPPORTED",
          "support_grade": "MODERATE",
          "evidence_refs": ["user_confirmed_place_01", "candidate_scope_01"],
          "allowed_surfaces": ["CANONICAL_TAG"]
        }
      ],
      "narrative": {
        "locale": "zh-Hans",
        "title": "古镇漫步",
        "title_outcome": "PRESENT",
        "title_length_class": "BASE_2_10",
        "time_label": "上午9:00–10:30",
        "story": "石板路连着旧屋，走到河边时，晚光落在水面。",
        "moment_line": null,
        "surface_claim_refs": {
          "TITLE": ["claim_city_walk"],
          "STORY": ["claim_city_walk", "claim_architecture", "claim_river_light"]
        },
        "span_bindings": [
          {
            "surface": "TITLE",
            "kind": "CLAIM",
            "start": 0,
            "end": 4,
            "text": "古镇漫步",
            "claim_refs": ["claim_city_walk"]
          },
          {
            "surface": "STORY",
            "kind": "CLAIM",
            "start": 0,
            "end": 7,
            "text": "石板路连着旧屋",
            "claim_refs": ["claim_architecture"]
          },
          {
            "surface": "STORY",
            "kind": "CLAIM",
            "start": 8,
            "end": 13,
            "text": "走到河边时",
            "claim_refs": ["claim_city_walk", "claim_river_light"]
          },
          {
            "surface": "STORY",
            "kind": "CLAIM",
            "start": 14,
            "end": 20,
            "text": "晚光落在水面",
            "claim_refs": ["claim_river_light"]
          }
        ]
      },
      "canonical_assignments": [
        {
          "concept_id": "ACTIVITY.CITY_WALK",
          "role": "PRIMARY",
          "rank": 0,
          "claim_refs": ["claim_city_walk"],
          "evidence_refs": ["observation_gate", "observation_river", "continuity_ledger_01"]
        },
        {
          "concept_id": "SETTING.TRADITIONAL_HISTORIC_DISTRICT",
          "role": "SECONDARY",
          "rank": 1,
          "claim_refs": ["claim_architecture"],
          "evidence_refs": ["observation_gate", "observation_hall"]
        },
        {
          "concept_id": "CENTRAL_SUBJECT.HISTORIC_ARCHITECTURE",
          "role": "SECONDARY",
          "rank": 2,
          "claim_refs": ["claim_architecture"],
          "evidence_refs": ["observation_gate", "observation_hall"]
        },
        {
          "concept_id": "OCCASION.TRAVEL_OUTING",
          "role": "SECONDARY",
          "rank": 3,
          "claim_refs": ["claim_travel_outing"],
          "evidence_refs": ["user_confirmed_place_01", "candidate_scope_01"]
        }
      ],
      "entity_links": [
        {
          "entity_id": "place_zhouzhuang_ancient_town",
          "entity_type": "PLACE",
          "display_name": "周庄古镇",
          "claim_refs": ["claim_exact_place"],
          "evidence_refs": ["user_confirmed_place_01"]
        }
      ],
      "protected_user_text": []
    },
    {
      "memory_id": "aha_playful_cat",
      "memory_type": "AHA",
      "candidate_id": "candidate_aha_01",
      "revision_id": "revision_final_01",
      "capture_start_ms": 35640000,
      "selected_content_unit_ids": ["unit_cat_cup_peak"],
      "active_media": [
        {
          "media_id": "media_cat_peak",
          "media_plan_ref": "media_plan_cat_peak",
          "evidence_anchor_ref": "anchor_cat_peak",
          "raw_asset_id": "manual_video_03",
          "format": "LIVE_2S",
          "hq_request_id": "hq_cat_peak",
          "semantic_scope_id": "scope_cat_cup_peak",
          "source_family_id": "source_family_cat_peak",
          "is_hero": false
        }
      ],
      "claims": [
        {
          "claim_id": "claim_cat_knocked_cup",
          "normalized_assertion": "一只猫碰倒了桌上的纸杯",
          "semantic_status": "CLAIM_SEMANTIC_SUPPORTED",
          "support_grade": "STRONG",